{
  "$schema": "https://json-schema.org/draft/2020-12/schema",
  "type": "object",
  "additionalProperties": false,
  "required": [
    "schema_version",
    "id",
    "purpose",
    "chapter",
    "exemplar_set",
    "assets",
    "sources",
    "world",
    "plan",
    "authority_effect"
  ],
  "properties": {
    "schema_version": {
      "const": 1
    },
    "id": {
      "type": "string",
      "pattern": "^writing-package:"
    },
    "purpose": {
      "type": "string",
      "minLength": 1
    },
    "chapter": {
      "type": "integer",
      "minimum": 1
    },
    "exemplar_set": {
      "type": "object",
      "additionalProperties": false,
      "required": [
        "path",
        "sha256"
      ],
      "properties": {
        "path": {
          "type": "string",
          "minLength": 1
        },
        "sha256": {
          "type": "string",
          "pattern": "^[a-f0-9]{64}$"
        }
      }
    },
    "assets": {
      "type": "array",
      "minItems": 1,
      "uniqueItems": true,
      "items": {
        "type": "object",
        "additionalProperties": false,
        "required": [
          "asset_ref",
          "sha256"
        ],
        "properties": {
          "asset_ref": {
            "type": "string",
            "minLength": 1
          },
          "sha256": {
            "type": "string",
            "pattern": "^[a-f0-9]{64}$"
          }
        }
      }
    },
    "sources": {
      "type": "array",
      "minItems": 0,
      "uniqueItems": true,
      "items": {
        "type": "object",
        "additionalProperties": false,
        "required": [
          "source_ref",
          "record_sha256"
        ],
        "properties": {
          "source_ref": {
            "type": "string",
            "minLength": 1
          },
          "record_sha256": {
            "type": "string",
            "pattern": "^[a-f0-9]{64}$"
          }
        }
      }
    },
    "world": {
      "type": "array",
      "minItems": 1,
      "uniqueItems": true,
      "items": {
        "type": "object",
        "additionalProperties": false,
        "required": [
          "path",
          "sha256"
        ],
        "properties": {
          "path": {
            "type": "string",
            "minLength": 1
          },
          "sha256": {
            "type": "string",
            "pattern": "^[a-f0-9]{64}$"
          }
        }
      }
    },
    "plan": {
      "type": "array",
      "minItems": 1,
      "uniqueItems": true,
      "items": {
        "type": "object",
        "additionalProperties": false,
        "required": [
          "path",
          "sha256"
        ],
        "properties": {
          "path": {
            "type": "string",
            "minLength": 1
          },
          "sha256": {
            "type": "string",
            "pattern": "^[a-f0-9]{64}$"
          }
        }
      }
    },
    "authority_effect": {
      "const": "NONE"
    },
    "operation_scope": {
      "enum": [
        "PRODUCTION",
        "RESEARCH",
        "BACKTEST"
      ]
    }
  }
}
