{
  "assets": [
    {
      "asset_ref": "asset:sha256:23861cce04acb8308e2d9c19a38445cddbe985b41fc8f0458d965e2379309072",
      "sha256": "23861cce04acb8308e2d9c19a38445cddbe985b41fc8f0458d965e2379309072"
    },
    {
      "asset_ref": "asset:sha256:626917a3603d00697ccb86e6be8d1bb5b40911ffad700436ea836cd8e6336261",
      "sha256": "626917a3603d00697ccb86e6be8d1bb5b40911ffad700436ea836cd8e6336261"
    },
    {
      "asset_ref": "asset:sha256:66508dc74b1e09e9b0ad69f0cb781ae881505ee4f446075d85386bfb228205b7",
      "sha256": "66508dc74b1e09e9b0ad69f0cb781ae881505ee4f446075d85386bfb228205b7"
    },
    {
      "asset_ref": "asset:sha256:6ab10932c4f8ae3580ec1f1db3034e8ba2fee58ae038db9556204ee11aeb0d44",
      "sha256": "6ab10932c4f8ae3580ec1f1db3034e8ba2fee58ae038db9556204ee11aeb0d44"
    },
    {
      "asset_ref": "asset:sha256:c1946d9ff097372aa0583eec627a5f37ec77ec3b076fa2229c23f7f441bb7eb0",
      "sha256": "c1946d9ff097372aa0583eec627a5f37ec77ec3b076fa2229c23f7f441bb7eb0"
    }
  ],
  "authority_effect": "NONE",
  "chapter": 83,
  "exemplar_set": {
    "path": "data/writing/exemplars/ch89-research-v2.json",
    "sha256": "dfbf649f9249e7e4ed5fa5b1829c1b0ebca38ec971a2cb132d3ce9370fbd373d"
  },
  "id": "writing-package:ch83:agent-research:v3",
  "operation_scope": "RESEARCH",
  "plan": [
    {
      "path": "data/project/plan_constraints_v1.json",
      "sha256": "8f3ca1572c57e6440d94eb151680f189994b6c2097a5c02609b55e35a32b94cd"
    },
    {
      "path": "data/planning/chapters/ch83.json",
      "sha256": "3143dabccd8387dafecf57133b4eb0b50445ca958a00250d9599993efa1714db"
    },
    {
      "path": "data/planning/contracts/agent-final-v1/83-S1.v2.json",
      "sha256": "ddf8d40bdcea825fcdbccf0d355a623029574159656f48610e4049b27a29ac67"
    },
    {
      "path": "data/planning/contracts/agent-final-v1/83-S2.v2.json",
      "sha256": "42e919b0eec728e518690d4dfb00f8ce1bc2216ef7eaf152b6e4b69d9b45b72f"
    },
    {
      "path": "data/planning/contracts/agent-final-v1/83-S3.v2.json",
      "sha256": "e1bfb521cea8691c8b5ba507e024a293ba5870a8fb11a8e1cc7a92fb6617ed86"
    }
  ],
  "purpose": "第83回全书会话研究试写：显式选择经模型编辑的场景合同版本。未知状态仍未验收，史料/语料/文学资格未授予；不修改稳定版。",
  "schema_version": 1,
  "sources": [],
  "world": [
    {
      "path": "data/world/m3_body.json",
      "sha256": "429ca248ea42aa0601e11a55d40fa446da92cee48936627a83b335ab9b18056e"
    },
    {
      "path": "data/world/m3_core.json",
      "sha256": "c4bf1c75fda8994fd846e570a64ae69efeb6ca17cd27e78c1bb1af4d7783d733"
    },
    {
      "path": "data/world/m3_knowledge.json",
      "sha256": "d8ee374ec667317af6ef304dc4b66ad7d3ceae9f20753c1b35cf029c73dee18b"
    },
    {
      "path": "data/world/m3_locations.json",
      "sha256": "ed1a4053f1459193777f486b3a9743c5aec28afb7d027dee12684da6e3a9d81b"
    },
    {
      "path": "data/world/m3_presence.json",
      "sha256": "7880480b001c321e50056e887f1285f6c7ccf975aed140d1515967ea925bb3bb"
    },
    {
      "path": "data/world/m3_resources.json",
      "sha256": "b823f72594d4a2af2216525cbfd3411b00d41c4ad0fa89830348933be6de7668"
    }
  ]
}
