{"assets":[{"asset_ref":"asset:sha256:23861cce04acb8308e2d9c19a38445cddbe985b41fc8f0458d965e2379309072","sha256":"23861cce04acb8308e2d9c19a38445cddbe985b41fc8f0458d965e2379309072"},{"asset_ref":"asset:sha256:626917a3603d00697ccb86e6be8d1bb5b40911ffad700436ea836cd8e6336261","sha256":"626917a3603d00697ccb86e6be8d1bb5b40911ffad700436ea836cd8e6336261"},{"asset_ref":"asset:sha256:66508dc74b1e09e9b0ad69f0cb781ae881505ee4f446075d85386bfb228205b7","sha256":"66508dc74b1e09e9b0ad69f0cb781ae881505ee4f446075d85386bfb228205b7"},{"asset_ref":"asset:sha256:6ab10932c4f8ae3580ec1f1db3034e8ba2fee58ae038db9556204ee11aeb0d44","sha256":"6ab10932c4f8ae3580ec1f1db3034e8ba2fee58ae038db9556204ee11aeb0d44"},{"asset_ref":"asset:sha256:c1946d9ff097372aa0583eec627a5f37ec77ec3b076fa2229c23f7f441bb7eb0","sha256":"c1946d9ff097372aa0583eec627a5f37ec77ec3b076fa2229c23f7f441bb7eb0"}],"authority_effect":"NONE","chapter":86,"exemplar_set":{"path":"data/writing/exemplars/ch89-research-v1.json","sha256":"5b93c888218bfa5d3287bf24ab2f5de6d01255fc8d8004d61577b154cb27333b"},"id":"writing-package:ch86:agent-research:v2","operation_scope":"RESEARCH","plan":[{"path":"data/project/plan_constraints_v1.json","sha256":"8f3ca1572c57e6440d94eb151680f189994b6c2097a5c02609b55e35a32b94cd"},{"path":"data/planning/chapters/ch86.json","sha256":"5f520934ec7e98bd6f20ebeafb45dfabee46c46253c883a3d82bc549e9c2c4a9"},{"path":"data/planning/contracts/agent-final-v1/86-S1.v2.json","sha256":"9f31b586dfc2dd260c9ee82a1765aa4daaba67cb0bb74fd441c52b9d41d1b3f6"},{"path":"data/planning/contracts/agent-final-v1/86-S2.v2.json","sha256":"e134e6a3a1eea20e82cab0f814ae4bf969603d53278633fc1fe8f698cf642339"},{"path":"data/planning/contracts/agent-final-v1/86-S3.v2.json","sha256":"3c1dc6b323df7eaf8a23fb2a780e7416e439d2b40be3cd76dd28ec8ff65c99ec"},{"path":"data/planning/contracts/agent-final-v1/86-S4.v2.json","sha256":"3e1ee138428507bf37bd6a71a4c915f6c1a9b06dc1e2c35423653cf72434bac8"},{"path":"data/planning/contracts/agent-final-v1/86-S5.v2.json","sha256":"7f6ba4e4e56d72f974476e18772ca8b57856ba0de574766f5c0cfd80414e1fc0"},{"path":"data/planning/contracts/agent-final-v1/86-S6.v2.json","sha256":"7143d53628e36e6daf3836c4e1d1efb7e81714b7e09563fa1af49811171c3522"}],"purpose":"第86回全书会话研究试写：显式选择经模型编辑的场景合同版本。未知状态仍未验收，史料/语料/文学资格未授予；不修改稳定版。","schema_version":1,"sources":[{"record_sha256":"d75e42caf94a7e3018466178aa019c7cd6dfef5d8c7a5b8aaacb7737d5426ec0","source_ref":"src:history:beijing:1774:rental-contract"},{"record_sha256":"19a44068e9dd9d3813cd5dd811e3e3fe6460d9ea41a04db7de2c3dab417c5164","source_ref":"src:history:cao:1728:pawn-tickets"},{"record_sha256":"556f34fd6f768c5869a8567d2b1e7a478135910b8cc6522b76664a1299e57b93","source_ref":"src:jimao:ch18:daiyu-death"}],"world":[{"path":"data/world/m3_body.json","sha256":"429ca248ea42aa0601e11a55d40fa446da92cee48936627a83b335ab9b18056e"},{"path":"data/world/m3_core.json","sha256":"c4bf1c75fda8994fd846e570a64ae69efeb6ca17cd27e78c1bb1af4d7783d733"},{"path":"data/world/m3_knowledge.json","sha256":"d8ee374ec667317af6ef304dc4b66ad7d3ceae9f20753c1b35cf029c73dee18b"},{"path":"data/world/m3_locations.json","sha256":"ed1a4053f1459193777f486b3a9743c5aec28afb7d027dee12684da6e3a9d81b"},{"path":"data/world/m3_presence.json","sha256":"7880480b001c321e50056e887f1285f6c7ccf975aed140d1515967ea925bb3bb"},{"path":"data/world/m3_resources.json","sha256":"b823f72594d4a2af2216525cbfd3411b00d41c4ad0fa89830348933be6de7668"}]}
